{
 "id": "level01",
 "name": "Level 01",
 "difficulty": 1,
 "startNodeId": "n138",
 "exitNodeId": "n2",
 "nodes": [
  {
   "id": "n2",
   "x": 0.4899,
   "y": 0.03888,
   "kind": "exit"
  },
  {
   "id": "n6",
   "x": 0.53595,
   "y": 0.08034,
   "kind": "deadend"
  },
  {
   "id": "n4",
   "x": 0.44421,
   "y": 0.08074,
   "kind": "deadend"
  },
  {
   "id": "n8",
   "x": 0.48884,
   "y": 0.0948,
   "kind": "junction"
  },
  {
   "id": "n11",
   "x": 0.57209,
   "y": 0.1258,
   "kind": "junction"
  },
  {
   "id": "n13",
   "x": 0.36079,
   "y": 0.14833,
   "kind": "junction"
  },
  {
   "id": "n14",
   "x": 0.65569,
   "y": 0.16328,
   "kind": "junction"
  },
  {
   "id": "n15",
   "x": 0.70776,
   "y": 0.16507,
   "kind": "deadend"
  },
  {
   "id": "n16",
   "x": 0.41764,
   "y": 0.20574,
   "kind": "junction"
  },
  {
   "id": "n17",
   "x": 0.60255,
   "y": 0.22727,
   "kind": "junction"
  },
  {
   "id": "n20",
   "x": 0.23096,
   "y": 0.2502,
   "kind": "deadend"
  },
  {
   "id": "n21",
   "x": 0.27843,
   "y": 0.25897,
   "kind": "junction"
  },
  {
   "id": "n24",
   "x": 0.36663,
   "y": 0.27512,
   "kind": "junction"
  },
  {
   "id": "n25",
   "x": 0.46015,
   "y": 0.29007,
   "kind": "deadend"
  },
  {
   "id": "n29",
   "x": 0.73291,
   "y": 0.29665,
   "kind": "deadend"
  },
  {
   "id": "n27",
   "x": 0.68225,
   "y": 0.29665,
   "kind": "junction"
  },
  {
   "id": "n30",
   "x": 0.51966,
   "y": 0.30682,
   "kind": "deadend"
  },
  {
   "id": "n32",
   "x": 0.43039,
   "y": 0.31699,
   "kind": "junction"
  },
  {
   "id": "n33",
   "x": 0.47715,
   "y": 0.32416,
   "kind": "junction"
  },
  {
   "id": "n34",
   "x": 0.5983,
   "y": 0.35227,
   "kind": "junction"
  },
  {
   "id": "n35",
   "x": 0.36663,
   "y": 0.3744,
   "kind": "junction"
  },
  {
   "id": "n36",
   "x": 0.22529,
   "y": 0.38995,
   "kind": "deadend"
  },
  {
   "id": "n37",
   "x": 0.60786,
   "y": 0.39892,
   "kind": "junction"
  },
  {
   "id": "n38",
   "x": 0.64293,
   "y": 0.40371,
   "kind": "junction"
  },
  {
   "id": "n39",
   "x": 0.2678,
   "y": 0.40909,
   "kind": "junction"
  },
  {
   "id": "n40",
   "x": 0.57917,
   "y": 0.41627,
   "kind": "junction"
  },
  {
   "id": "n41",
   "x": 0.70138,
   "y": 0.42584,
   "kind": "junction"
  },
  {
   "id": "n50",
   "x": 0.26355,
   "y": 0.43152,
   "kind": "junction"
  },
  {
   "id": "n53",
   "x": 0.65462,
   "y": 0.43331,
   "kind": "junction"
  },
  {
   "id": "n44",
   "x": 0.22529,
   "y": 0.42943,
   "kind": "deadend"
  },
  {
   "id": "n54",
   "x": 0.32023,
   "y": 0.43461,
   "kind": "deadend"
  },
  {
   "id": "n47",
   "x": 0.56323,
   "y": 0.43182,
   "kind": "junction"
  },
  {
   "id": "n51",
   "x": 0.4559,
   "y": 0.43481,
   "kind": "junction"
  },
  {
   "id": "n55",
   "x": 0.72157,
   "y": 0.45096,
   "kind": "junction"
  },
  {
   "id": "n56",
   "x": 0.45484,
   "y": 0.45215,
   "kind": "junction"
  },
  {
   "id": "n59",
   "x": 0.5898,
   "y": 0.46232,
   "kind": "junction"
  },
  {
   "id": "n62",
   "x": 0.66791,
   "y": 0.46322,
   "kind": "junction"
  },
  {
   "id": "n64",
   "x": 0.45271,
   "y": 0.47488,
   "kind": "junction"
  },
  {
   "id": "n69",
   "x": 0.67535,
   "y": 0.48415,
   "kind": "junction"
  },
  {
   "id": "n71",
   "x": 0.63018,
   "y": 0.48774,
   "kind": "junction"
  },
  {
   "id": "n70",
   "x": 0.28374,
   "y": 0.48923,
   "kind": "junction"
  },
  {
   "id": "n72",
   "x": 0.39001,
   "y": 0.53708,
   "kind": "junction"
  },
  {
   "id": "n85",
   "x": 0.50275,
   "y": 0.55475,
   "kind": "junction"
  },
  {
   "id": "n86",
   "x": 0.39532,
   "y": 0.56878,
   "kind": "junction"
  },
  {
   "id": "n84",
   "x": 0.58023,
   "y": 0.56699,
   "kind": "junction"
  },
  {
   "id": "n91",
   "x": 0.7101,
   "y": 0.58589,
   "kind": "deadend"
  },
  {
   "id": "n97",
   "x": 0.49097,
   "y": 0.60144,
   "kind": "junction"
  },
  {
   "id": "n101",
   "x": 0.20191,
   "y": 0.61543,
   "kind": "junction"
  },
  {
   "id": "n99",
   "x": 0.356,
   "y": 0.61065,
   "kind": "junction"
  },
  {
   "id": "n103",
   "x": 0.24655,
   "y": 0.62241,
   "kind": "junction"
  },
  {
   "id": "n104",
   "x": 0.35069,
   "y": 0.6256,
   "kind": "junction"
  },
  {
   "id": "n105",
   "x": 0.25292,
   "y": 0.65132,
   "kind": "deadend"
  },
  {
   "id": "n106",
   "x": 0.45909,
   "y": 0.65789,
   "kind": "deadend"
  },
  {
   "id": "n107",
   "x": 0.5186,
   "y": 0.66148,
   "kind": "junction"
  },
  {
   "id": "n108",
   "x": 0.48884,
   "y": 0.67703,
   "kind": "junction"
  },
  {
   "id": "n109",
   "x": 0.43571,
   "y": 0.68361,
   "kind": "junction"
  },
  {
   "id": "n110",
   "x": 0.59724,
   "y": 0.69079,
   "kind": "deadend"
  },
  {
   "id": "n113",
   "x": 0.59369,
   "y": 0.72189,
   "kind": "deadend"
  },
  {
   "id": "n118",
   "x": 0.36196,
   "y": 0.73804,
   "kind": "junction"
  },
  {
   "id": "n115",
   "x": 0.42189,
   "y": 0.73266,
   "kind": "junction"
  },
  {
   "id": "n120",
   "x": 0.39957,
   "y": 0.76615,
   "kind": "junction"
  },
  {
   "id": "n121",
   "x": 0.34644,
   "y": 0.78409,
   "kind": "deadend"
  },
  {
   "id": "n122",
   "x": 0.54942,
   "y": 0.79127,
   "kind": "junction"
  },
  {
   "id": "n126",
   "x": 0.58342,
   "y": 0.82835,
   "kind": "junction"
  },
  {
   "id": "n125",
   "x": 0.55101,
   "y": 0.82416,
   "kind": "junction"
  },
  {
   "id": "n127",
   "x": 0.44421,
   "y": 0.88098,
   "kind": "deadend"
  },
  {
   "id": "n130",
   "x": 0.49168,
   "y": 0.9071,
   "kind": "junction"
  },
  {
   "id": "n131",
   "x": 0.41977,
   "y": 0.91866,
   "kind": "deadend"
  },
  {
   "id": "n132",
   "x": 0.56642,
   "y": 0.92285,
   "kind": "deadend"
  },
  {
   "id": "n134",
   "x": 0.54835,
   "y": 0.93959,
   "kind": "deadend"
  },
  {
   "id": "n136",
   "x": 0.49097,
   "y": 0.94677,
   "kind": "junction"
  },
  {
   "id": "n137",
   "x": 0.5271,
   "y": 0.96232,
   "kind": "deadend"
  },
  {
   "id": "n138",
   "x": 0.45696,
   "y": 0.96292,
   "kind": "start"
  }
 ],
 "edges": [
  {
   "id": "e0",
   "from": "n2",
   "to": "n8",
   "polyline": [
    [
     0.4899,
     0.03888
    ],
    [
     0.48884,
     0.0948
    ]
   ],
   "lengthN": 0.07157
  },
  {
   "id": "e1",
   "from": "n4",
   "to": "n8",
   "polyline": [
    [
     0.44421,
     0.08074
    ],
    [
     0.45696,
     0.08433
    ],
    [
     0.48778,
     0.10167
    ],
    [
     0.48884,
     0.0948
    ]
   ],
   "lengthN": 0.0505
  },
  {
   "id": "e2",
   "from": "n6",
   "to": "n8",
   "polyline": [
    [
     0.53595,
     0.08034
    ],
    [
     0.51753,
     0.08792
    ],
    [
     0.4899,
     0.08792
    ],
    [
     0.48884,
     0.0948
    ]
   ],
   "lengthN": 0.04517
  },
  {
   "id": "e3",
   "from": "n8",
   "to": "n13",
   "polyline": [
    [
     0.48884,
     0.0948
    ],
    [
     0.48778,
     0.10167
    ],
    [
     0.47396,
     0.10945
    ],
    [
     0.42614,
     0.11722
    ],
    [
     0.39745,
     0.13278
    ],
    [
     0.3762,
     0.14055
    ],
    [
     0.37194,
     0.15012
    ],
    [
     0.36079,
     0.14833
    ]
   ],
   "lengthN": 0.12669
  },
  {
   "id": "e4",
   "from": "n8",
   "to": "n11",
   "polyline": [
    [
     0.48884,
     0.0948
    ],
    [
     0.48778,
     0.10167
    ],
    [
     0.54198,
     0.13098
    ],
    [
     0.56217,
     0.13397
    ],
    [
     0.57209,
     0.1258
    ]
   ],
   "lengthN": 0.09067
  },
  {
   "id": "e5",
   "from": "n11",
   "to": "n14",
   "polyline": [
    [
     0.57209,
     0.1258
    ],
    [
     0.56217,
     0.13397
    ],
    [
     0.56536,
     0.13696
    ],
    [
     0.63124,
     0.14414
    ],
    [
     0.6525,
     0.1555
    ],
    [
     0.65569,
     0.16328
    ]
   ],
   "lengthN": 0.09679
  },
  {
   "id": "e6",
   "from": "n13",
   "to": "n16",
   "polyline": [
    [
     0.36079,
     0.14833
    ],
    [
     0.37194,
     0.15012
    ],
    [
     0.38895,
     0.17524
    ],
    [
     0.40808,
     0.19019
    ],
    [
     0.4102,
     0.19916
    ],
    [
     0.41764,
     0.20574
    ]
   ],
   "lengthN": 0.0879
  },
  {
   "id": "e7",
   "from": "n14",
   "to": "n15",
   "polyline": [
    [
     0.65569,
     0.16328
    ],
    [
     0.67906,
     0.16388
    ],
    [
     0.68969,
     0.16866
    ],
    [
     0.70776,
     0.16507
    ]
   ],
   "lengthN": 0.04046
  },
  {
   "id": "e8",
   "from": "n14",
   "to": "n17",
   "polyline": [
    [
     0.65569,
     0.16328
    ],
    [
     0.65462,
     0.16926
    ],
    [
     0.63549,
     0.19318
    ],
    [
     0.6153,
     0.20514
    ],
    [
     0.60255,
     0.22727
    ]
   ],
   "lengthN": 0.09215
  },
  {
   "id": "e9",
   "from": "n16",
   "to": "n24",
   "polyline": [
    [
     0.41764,
     0.20574
    ],
    [
     0.40383,
     0.21711
    ],
    [
     0.39957,
     0.23086
    ],
    [
     0.37938,
     0.25478
    ],
    [
     0.37513,
     0.26974
    ],
    [
     0.36663,
     0.27512
    ]
   ],
   "lengthN": 0.09798
  },
  {
   "id": "e10",
   "from": "n16",
   "to": "n17",
   "polyline": [
    [
     0.41764,
     0.20574
    ],
    [
     0.47078,
     0.20634
    ],
    [
     0.51435,
     0.2195
    ],
    [
     0.53666,
     0.22069
    ],
    [
     0.55685,
     0.22488
    ],
    [
     0.60255,
     0.22727
    ]
   ],
   "lengthN": 0.13859
  },
  {
   "id": "e11",
   "from": "n17",
   "to": "n27",
   "polyline": [
    [
     0.60255,
     0.22727
    ],
    [
     0.61105,
     0.24581
    ],
    [
     0.65994,
     0.26794
    ],
    [
     0.67694,
     0.28289
    ],
    [
     0.68225,
     0.29665
    ]
   ],
   "lengthN": 0.11042
  },
  {
   "id": "e12",
   "from": "n20",
   "to": "n21",
   "polyline": [
    [
     0.23096,
     0.2502
    ],
    [
     0.26036,
     0.2494
    ],
    [
     0.27205,
     0.25299
    ],
    [
     0.27843,
     0.25897
    ]
   ],
   "lengthN": 0.03972
  },
  {
   "id": "e13",
   "from": "n21",
   "to": "n24",
   "polyline": [
    [